,id,direction,title
,,,
0.0,1301tlr,https://slate.com/business/2023/04/cars-buttons-touchscreens-vw-porsche-nissan-hyundai.html,The Glorious Return of an Old-School Car Feature: Automakers are starting to admit that drivers hate touchscreens. Buttons are back!
1.0,134jnsn,https://www.theverge.com/2023/5/1/23706311/hinton-godfather-of-ai-threats-fears-warnings,‘Godfather of AI’ quits Google with regrets and fears about his life’s work
2.0,131wnmo,https://www.wired.com/story/protecting-kids-social-media-act/,A US Bill Would Ban Kids Under 13 From Joining Social Media
3.0,1356b6g,https://kslnewsradio.com/2003298/adult-website-pornhub-blocks-users-in-utah-from-accessing-the-site/,Adult website PornHub blocks users in Utah from accessing the site
4.0,133t2kw,https://www.axios.com/2023/04/27/unions-tech-industry-labor-youtube-sega,Push to unionize tech industry makes advances
5.0,135min8,https://mashable.com/article/wordpress-drops-twitter-jetpack-social-sharing,WordPress drops Twitter social sharing due to API price hike
6.0,1364818,https://www.vice.com/en/article/m7bvbv/anti-porn-lobbyists-pressure-reddit-to-shut-down-its-nsfw-communities,Anti-porn lobbyists pressure Reddit to shut down its NSFW communities
7.0,130mcsu,https://www.techspot.com/news/98475-meta-metaverse-focused-reality-labs-lost-399-billion.html,"Meta's Reality Labs lost $3.99 billion last year, bringing its total losses since 2020 to $30 billion"
8.0,131mdt1,https://www.engadget.com/nycs-transport-authority-will-no-longer-post-service-alerts-on-twitter-051701441.html,NYC's transport authority will no longer post service alerts on Twitter
9.0,132pcb0,https://www.cbc.ca/news/canada/montreal/ai-child-abuse-images-1.6823808,"Quebec man who created synthetic, AI-generated child pornography sentenced to prison"
10.0,1337ifd,https://www.cnn.com/2023/04/29/business/lyft-return-to-office/index.html,Lyft CEO tells employees they must return to the office
11.0,130hqyz,https://www.businessinsider.com/chatgpt-second-job-overworking-overemployment-2023-4,"Employee says ChatGPT carries out 80% of his work duties, which allowed him to take on a 2nd job, report says"
12.0,1312kjo,https://arstechnica.com/tech-policy/2023/04/colorado-governor-signs-tractor-right-to-repair-law-opposed-by-john-deere/,Colorado governor signs tractor right-to-repair law opposed by John Deere
13.0,134586q,https://www.vice.com/en/article/z3mnve/we-spoke-to-people-who-started-using-chatgpt-as-their-therapist,"We Spoke to People Who Started Using ChatGPT As Their Therapist: Mental health experts worry the high cost of healthcare is driving more people to confide in OpenAI's chatbot, which often reproduces harmful biases."
14.0,130t1ch,https://theconversation.com/how-shading-crops-with-solar-panels-can-improve-farming-lower-food-costs-and-reduce-emissions-202094,"How shading crops with solar panels can improve farming, lower food costs and reduce emissions"
