,id,direction,title
,,,
0.0,13yc62g,https://www.cnn.com/2023/06/01/tech/reddit-outrage-data-access-charge/index.html,Reddit sparks outrage after a popular app developer said it wants him to pay $20 million a year for data access
1.0,141borj,https://www.theverge.com/2023/6/5/23749188/reddit-subreddit-private-protest-api-changes-apollo-charges,"Major Reddit communities will go dark to protest threat to third-party apps | App developers have said next month’s changes to Reddit’s API pricing could make their apps unsustainable. Now, dozens of the site’s biggest subreddits plan to go private for two days in protest."
2.0,144g35v,https://www.theverge.com/2023/6/8/23754183/apollo-reddit-app-shutting-down-api,Apollo for Reddit is shutting down
3.0,141to4k,https://arstechnica.com/gadgets/2023/06/reddits-plan-to-kill-third-party-apps-sparks-widespread-protests/,Reddit’s plan to kill third-party apps sparks widespread protests
4.0,13zb517,https://www.theguardian.com/world/2023/jun/03/anti-abortion-lawmakers-donation-amazon-google-comcast,Amazon and Google fund anti-abortion lawmakers through complex shell game
5.0,1439n76,https://www.vice.com/en/article/m7bbga/apples-vision-pro-augmented-virtual-reality-h,"Apple’s Vision Pro Is a $3,500 Ticket to Nowhere | A decade after Facebook bought Oculus, VR still has no appeal except as an expensive novelty toy."
6.0,1442xur,https://arstechnica.com/tech-policy/2023/06/robocalls-claiming-voters-would-get-mandatory-vaccines-result-in-5m-fine/,Robocalls claiming voters would get “mandatory vaccines” result in $5M fine
7.0,13zx4is,https://finance.yahoo.com/news/chip-maker-tsmc-needs-hire-100000012.html,"Chipmaker TSMC needs to hire 4,500 Americans at its new Arizona plants. Its ‘brutal’ corporate culture is getting in the way"
8.0,143m7u6,https://www.bbc.com/news/world-us-canada-65791190,US doctors forced to ration as cancer drug shortages hit nationwide
9.0,142ql07,https://www.wsj.com/articles/reddit-is-cutting-about-5-of-its-workforce-and-slowing-hiring-amid-restructuring-63cfade9,Reddit Laying Off About 90 Employees and Slowing Hiring Amid Restructuring: Moves aim to help social-media company break even next year
10.0,140q8v6,https://businessinsider.com/voluntary-smartphone-ban-for-kids-ireland-town-greystones-2023-6,Parents in a town in Ireland came together to voluntarily ban smartphones for kids as old as 13
11.0,1406hyj,https://jacobin.com/2023/06/meta-is-trying-and-failing-to-crush-unions-in-kenya,"Meta Is Trying, and Failing, to Crush Unions in Kenya"
12.0,142pxi2,https://www.theguardian.com/world/2023/jun/06/whistleblower-ufo-alien-tech-spacecraft,US urged to reveal UFO evidence after claim that it has intact alien vehicles. Whistleblower former intelligence official says government posseses ‘intact and partially intact’ craft of non-human origin.
13.0,144gpuq,https://www.macrumors.com/2023/06/08/apollo-shutting-down-june-30/,Popular Reddit App Apollo Shutting Down on June 30
14.0,1445xd2,https://archive.ph/FWbBO,A Microsoft worker who successfully unionized sees a 'wave of labor organizing that will take over the country.'
