,id,direction,title
,,,
0.0,ysh4x7,https://arstechnica.com/tech-policy/2022/11/twitter-quietly-drops-8-paid-verification-tricking-people-not-ok-musk-says/,"Twitter quietly drops $8 paid verification; “tricking people not OK,” Musk says"
1.0,yqy98f,https://gizmodo.com/amazon-market-cap-amazon-prime-e-commerce-1849764529,Nailed It: Amazon Becomes the First Company Ever to Lose $1 Trillion in Stock Value
2.0,ys1xkh,https://arstechnica.com/gadgets/2022/11/reddit-now-lets-you-mute-subreddits-you-dont-like/,Reddit now lets you mute subreddits you don’t like
3.0,yqfy9z,https://www.businessinsider.com/meta-layoffs-employees-facebook-mark-zuckerberg-metaverse-bet-2022-11?international=true&r=US&IR=T,"Meta says it will lay off more than 11,000 employees"
4.0,yv3y7f,https://www.cnbc.com/2022/11/14/amazon-reportedly-plans-to-lay-off-about-10000-employees-starting-this-week.html,"Amazon reportedly plans to lay off about 10,000 employees starting this week"
5.0,yrnjii,https://arstechnica.com/tech-policy/2022/11/musk-bans-remote-work-at-twitter-warns-staff-of-dire-economic-outlook/,"Musk bans remote work at Twitter, warns staff of “dire” economic outlook"
6.0,ytqyzq,https://abcnews.go.com/US/wireStory/prosecutors-push-15-year-sentence-theranos-ceo-holmes-93181759,Prosecutors push 15-year sentence for Theranos' CEO Holmes
7.0,yuslgx,https://www.businessinsider.com/meta-employee-fired-two-days-after-moving-to-canada-post-2022-11?international=true&r=US&IR=T,A software engineer from India says he was fired by Meta 2 days after he moved to Canada for his job
8.0,yue6at,https://www.businessinsider.com/elon-musk-twitter-takeover-user-growth-rivals-mastodon-tumblr-2022-11,"Elon Musk's takeover of Twitter has translated into huge user growth — for upstart social media platforms like Mastodon and Tumblr, according to new data"
9.0,yq0tta,https://www.reuters.com/technology/meta-will-begin-laying-off-employees-wednesday-morning-wsj-2022-11-08/,Meta will begin laying off employees on Wednesday morning - WSJ Reuters
10.0,yt8i6u,https://www.businessinsider.com/fired-meta-employees-are-writing-badge-posts-on-social-media-2022-11,Dozens of fired Meta employees are writing heart-wrenching 'badge posts' on social media
11.0,yt3f1z,https://www.nytimes.com/2022/11/12/us/politics/fbi-pegasus-spyware-phones-nso.html,Internal Documents Show How Close the F.B.I. Came to Deploying Spyware
12.0,yuaa9b,https://www.abc.net.au/news/2022-11-14/former-prisoner-struggling-with-the-use-of-technology/101641072,"Former inmates struggling to reintegrate into society due to minimal experience with digital techology/Former prisoner Anthony Smith is free, but unable to navigate the modern digital world, leaving him wondering if he would be better off back in prison."
13.0,yshhjs,https://gizmodo.com/twitter-could-go-bankrupt-musk-says-1849770434,"Twitter Could Go Bankrupt, Elon Says"
14.0,yvk0k0,https://www.cbsnews.com/news/google-location-tracking-data-william-tong-392-million-settlement/,Google to pay 40 states $392M in location-tracking settlement
