,id,direction,title
,,,
0.0,10sigt9,https://www.businessinsider.com/twitter-ordered-label-converted-office-bedrooms-sleeping-areas-san-francisco-2023-2,Elon Musk's Twitter ordered by officials to properly label bedrooms in San Francisco HQ as sleeping areas — or convert them back to offices within 15 days
1.0,10thd94,https://variety.com/2023/digital/news/twitter-businesses-price-verified-gold-checkmark-1000-monthly-1235512750/,"Elon Musk Wants to Charge Businesses on Twitter $1,000 per Month to Retain Verified Check-Marks"
2.0,10pzhdp,https://insideevs.com/news/640947/tesla-model-y-steering-falls-off/,"Tesla Model Y Steering Wheel Falls Off While Driving, One Week After Delivery | This owner experienced first-hand what bad quality control looks like."
3.0,10p0k2v,https://www.businessinsider.com/google-layoffs-mental-health-and-wellbeing-director-jobs-workers-tech-2023-1,"Google's head of mental health and wellbeing was among the 12,000 workers laid off by the tech giant"
4.0,10tkibu,https://www.pcmag.com/news/chatgpt-passes-google-coding-interview-for-level-3-engineer-with-183k-salary,ChatGPT Passes Google Coding Interview for Level 3 Engineer With $183K Salary
5.0,10qnv0x,https://www.bbc.com/news/world-australia-64481317,Missing radioactive capsule found in Australia
6.0,10s1nbf,https://businessinsider.com/reddit-job-cuts-employees-livid-company-painting-them-low-performers-2023-2,Reddit Staffers Who Lost Jobs Livid at Being Painted As Low Performers
7.0,10rqn6r,https://m.slashdot.org/story/410297,"Netflix Made an Anime Using AI Due To a 'Labor Shortage,' and Fans Are Pissed"
8.0,10qvmqj,https://www.businessinsider.com/tech-layoffs-pagerduty-ceo-apologizes-martin-luther-king-jr-quote-2023-2,"A tech CEO apologized for quoting Martin Luther King Jr. when announcing layoffs, calling it 'inappropriate and insensitive'"
9.0,10tv2fx,https://www.washingtontimes.com/news/2023/feb/3/nsa-wooing-thousands-laid-big-tech-workers-spy-age/,NSA wooing thousands of laid-off Big Tech workers for spy agency’s hiring spree
10.0,10sl7x1,https://appleinsider.com/articles/23/02/03/netflix-says-strict-new-password-sharing-rules-were-posted-in-error,Netflix says strict new password sharing rules were posted in error
11.0,10uct4o,https://www.bloomberg.com/news/articles/2023-02-03/google-invests-almost-400-million-in-ai-startup-anthropic,Google Invests Almost $400 Million in ChatGPT Rival Anthropic
12.0,10q057u,https://www.techdirt.com/2023/01/31/netflixs-password-sharing-cash-grab-finally-arrives-in-the-states/,Netflix’s Password Sharing Cash Grab Finally Arrives In The States
13.0,10pfbyv,https://businessinsider.com/princeton-prof-chatgpt-bullshit-generator-impact-workers-not-ai-revolution-2023-1,Princeton computer science professor says don't panic over 'bullshit generator' ChatGPT
14.0,10r7xxo,https://businessinsider.com/sam-altman-chatgpt-openai-ceo-career-net-worth-ycombinator-prepper-2023-1,"Meet OpenAI CEO Sam Altman, who learned to code at 8 and is a doomsday prepper with a stash of gold, guns, and gas masks"
