,id,direction,title
,,,
0.0,11zg1ki,https://www.theverge.com/2023/3/23/23652373/ftc-click-to-cancel-subscription-service-dark-patterns-ban,The FTC wants to ban those tough-to-cancel gym and cable subscriptions | The proposed ‘click to cancel’ rule would require companies to let you cancel a membership in as many steps as it takes to sign up.
1.0,11xmuny,https://www.thedrive.com/news/hyundai-promises-to-keep-buttons-in-cars-because-touchscreen-controls-are-dangerous,Hyundai Promises To Keep Buttons in Cars Because Touchscreen Controls Are Dangerous
2.0,11wh7rs,https://www.techspot.com/news/97995-data-center-uses-waste-heat-warm-public-pool.html,"Data center uses its waste heat to warm public pool, saving $24,000 per year | Stopping waste heat from going to waste"
3.0,11zvo19,https://arstechnica.com/tech-policy/2023/03/click-to-cancel-rule-would-penalize-companies-that-make-you-cancel-by-phone/,"“Click-to-cancel” rule would penalize companies that make you cancel by phone - Canceling a subscription shouldn't be harder than signing up, FTC proposal says."
4.0,11xizeg,https://www.independent.co.uk/life-style/meta-recruiter-salary-layoffs-tiktok-b2303147.html,"Former Meta recruiter claims she got paid $190,000 a year to do ‘nothing’ amid company’s layoffs"
5.0,11vhx3d,https://www.vanityfair.com/news/2023/03/buzzfeed-news-profit-strategy,"BuzzFeed, after gutting its newsroom, asks reporters to produce even more — Meanwhile, the company's stock is struggling, revenue is in free fall, and editorial ambitions remain hazy"
6.0,11yj7r3,https://www.techradar.com/news/fcc-cracks-down-on-spammy-text-messages,FCC taking a stand against spam texting - Phone companies must block text messages coming from shady sources
7.0,11z0fuf,https://arstechnica.com/science/2023/03/moderna-ceo-says-us-govt-got-covid-shots-at-discount-ahead-of-400-price-hike/,"Moderna CEO brazenly defends 400% COVID shot price hike, downplays NIH’s role"
8.0,11uoy2x,https://thewalrus.ca/will-ai-actually-mean-well-be-able-to-work-less/?utm_source=reddit&utm_medium=referral,"Will AI Actually Mean We’ll Be Able to Work Less? - The idea that tech will free us from drudgery is an attractive narrative, but history tells a different story"
9.0,11x3wiv,https://edition.cnn.com/2023/03/20/tech/google-layoffs-employee-culture/index.html,Google was beloved as an employer for years. Then it laid off thousands by email
10.0,11yjsfv,https://gizmodo.com/ron-desantis-google-should-be-broken-up-monopoly-1850249561,Ron DeSantis Said Google Should Be Broken Up The probable presidential candidate said Big Tech was worse than Gilded Age monopolies
11.0,11u82oz,https://arstechnica.com/gadgets/2023/03/employees-say-google-is-botching-those-12000-layoffs/,"Google won’t honor medical leave during its layoffs, outraging employees | Ex-Googler says she was laid off from her hospital bed shortly after giving birth."
12.0,11u1exe,https://www.businessinsider.com/ticketmaster-will-refund-fees-cure-fans-after-robert-smith-intervened-2023-3,Ticketmaster will give Cure fans a refund after Robert Smith said he was 'sickened' by its additional charges and demanded an explanation
13.0,11vzgbu,https://www.washingtonpost.com/world/2023/03/19/india-punjab-intermet-ban-amritpal-singh/,India cuts internet for 27 million people amid search for fugitive
14.0,11w698b,https://wapo.st/3FAhA8h,"How single-celled yeasts are doing the work of 1,500-pound cows: Cowless dairy is here, with the potential to shake up the future of animal dairy and plant-based milks"
