,id,direction,title
,,,
0.0,t3qrkw,https://www.businessinsider.com/elon-musk-jet-tracking-teen-russian-oligarch-jets-twitter-account-2022-2,The teen famous for tracking Elon Musk's jet has a new target: Russian oligarchs
1.0,t4ynmb,https://www.engadget.com/biden-wants-to-ban-advertising-targeted-toward-kids-052140748.html,President of USA wants to ban advertising targeted toward kids
2.0,t2phdt,https://www.reuters.com/world/europe/russia-demands-google-restore-access-its-media-youtube-channels-ukraine-2022-02-27/,Russia demands Google restore access to its media YouTube channels in Ukraine
3.0,t44iav,https://mashable.com/article/reddit-russia-subreddit-quarantined-ukraine,Reddit has quarantined r/Russia due to misinformation
4.0,t4osws,https://www.businessinsider.com/workers-first-union-push-at-amazon-retail-store-want-25hr-2022-3,"Workers behind the first union push at an Amazon retail store just sent management a list of demands, including a starting wage of $25 an hour"
5.0,t46sgm,https://www.rollingstone.com/politics/politics-news/ukraine-icann-russia-internet-runet-disconnection-1314278/,Exclusive: Ukraine Pushes to Unplug Russia From the Internet
6.0,t5p6bt,https://www.theverge.com/2022/3/2/22958900/tiktok-state-ag-investigation-teens-kids-mental-physical-health,TikTok faces investigation into its impact on young people’s mental health
7.0,t78nkb,https://www.forbes.com/sites/jackkelly/2022/03/05/twitter-employees-can-work-from-home-forever-or-wherever-you-feel-most-productive-and-creative/,Twitter Employees Can Work From Home ‘Forever’ Or ‘Wherever You Feel Most Productive And Creative’
8.0,t3eyu9,https://www.businessinsider.com/meta-russia-linked-hacking-group-fake-footage-ukraine-surrender-2022-2,"A Russia-linked hacking group broke into Facebook accounts and posted fake footage of Ukrainian soldiers surrendering, Meta says"
9.0,t51xtf,https://www.businessinsider.com/explainer-why-meta-warned-it-might-quit-europe-2022-3,Meta warned it might quit Europe. The data-sharing mechanisms that emerged after Snowden spying revelations are at the heart of it.
10.0,t2e00v,https://www.windowscentral.com/intel-amd-russia-sanctions-ban-chips,AMD and Intel reportedly are suspending processor shipments for industrial use to Russia
11.0,t2bit5,https://www.reuters.com/technology/musk-says-starlink-active-ukraine-russian-invasion-disrupts-internet-2022-02-27/,Musk says Starlink active in Ukraine as Russian invasion disrupts internet
12.0,t6gvn0,https://www.ft.com/content/0d6b80ed-964a-4783-aab5-0e7bb68ba5e5,Sony and Honda plan electric vehicle tie-up to take on Tesla
13.0,t5cpz4,https://www.theverge.com/2022/3/2/22958745/amazon-book-4-star-pop-up-physical-retail-locations-closing,"Amazon is closing all 68 of its Books, 4-Star, and Pop Up physical stores"
14.0,t3oada,https://variety.com/2022/tv/global/netflix-russian-propaganda-channels-1235192082/,Netflix Declines to Carry Russian Propaganda Channels
